653	Lake City, Florida, offers natural beauty and outdoor activities nearby.	[82389, 4409, 11, 9784, 11, 6209, 5933, 13444, 323, 16166, 7640, 14373, 13]	13	ok
654	Locations farthest from Salt Lake City are French Southern Territories.	[44137, 3117, 61943, 505, 28138, 11940, 4409, 527, 8753, 16642, 87443, 13]	12	ok
655	Park City offers a blend of accessibility and rustic charm.	[64706, 4409, 6209, 264, 20955, 315, 40800, 323, 58372, 32353, 13]	11	ok
656	Hinsdale County is the most remote county in the lower 48.	[39, 1354, 35283, 6406, 374, 279, 1455, 8870, 14189, 304, 279, 4827, 220, 2166, 13]	15	ok
657	Hinsdale County boasts unique wilderness and public land features.	[39, 1354, 35283, 6406, 38119, 5016, 49362, 323, 586, 4363, 4519, 13]	12	ok
658	Lake City is a Seattle neighborhood centered around Lake City Way.	[82389, 4409, 374, 264, 16759, 12818, 31288, 2212, 11940, 4409, 12424, 13]	12	ok
659	John Dee's angelic language is a 16th-century English occult script.	[13379, 56004, 596, 34426, 292, 4221, 374, 264, 220, 845, 339, 34457, 6498, 74926, 5429, 13]	16	ok
660	Enochian language is a constructed angelic occult script system.	[1737, 5059, 1122, 4221, 374, 264, 20968, 34426, 292, 74926, 5429, 1887, 13]	13	ok
661	Enochian language originates from Dee's claims about Enoch's knowledge.	[1737, 5059, 1122, 4221, 99970, 505, 56004, 596, 8349, 922, 469, 77118, 596, 6677, 13]	15	ok
662	Angels and demons know Enochian sigils, a magical practice.	[10976, 2053, 323, 45075, 1440, 469, 77118, 1122, 8531, 8839, 11, 264, 24632, 6725, 13]	15	ok
663	Enochian language is an alleged angelic construct system.	[1737, 5059, 1122, 4221, 374, 459, 10711, 34426, 292, 9429, 1887, 13]	12	ok
664	Nokian Tyres produces high-quality winter tyres globally effectively worldwide.	[45, 564, 1122, 14221, 417, 19159, 1579, 22867, 12688, 69793, 31550, 13750, 15603, 13]	14	ok
665	Enochian language is integral to magical practice and study.	[1737, 5059, 1122, 4221, 374, 26154, 311, 24632, 6725, 323, 4007, 13]	12	ok
666	Angelic language is a transformed Enochian system of divine communication.	[10976, 43723, 4221, 374, 264, 24411, 469, 77118, 1122, 1887, 315, 30467, 10758, 13]	14	ok
667	Enochian language facilitates angelic communication through sacred symbols.	[1737, 5059, 1122, 4221, 73633, 34426, 292, 10758, 1555, 32442, 18210, 13]	12	ok
668	Dr. John Dee and Sir Edward Kelly received Enochian alphabet.	[9023, 13, 3842, 56004, 323, 17177, 22653, 19178, 4036, 469, 77118, 1122, 28890, 13]	14	ok
669	Home buyers typically cover the appraiser's fee and costs.	[7778, 23455, 11383, 3504, 279, 917, 969, 12329, 596, 11307, 323, 7194, 13]	13	ok
670	Mortgage lenders use appraisals to determine property value.	[44, 371, 15292, 46115, 1005, 917, 41098, 1147, 311, 8417, 3424, 907, 13]	13	ok
671	Louisiana board takes disciplinary action against appraisal management companies.	[67215, 12699, 4580, 5097, 57315, 1957, 2403, 79392, 6373, 5220, 13]	11	ok
672	Home appraisal is a crucial step in mortgage process evaluation.	[7778, 79392, 374, 264, 16996, 3094, 304, 21515, 1920, 16865, 13]	11	ok
673	Capital One charges extra for managing appraisal process, not just appraisal.	[64693, 3861, 10405, 5066, 369, 18646, 79392, 1920, 11, 539, 1120, 79392, 13]	13	ok
674	Banks exploit appraisal fees through AMC arrangements with ownership interests.	[33, 4129, 33294, 79392, 12718, 1555, 75409, 28904, 449, 15637, 12034, 13]	12	ok
675	Don't judge a lender solely on a small fee discrepancy.	[8161, 956, 11913, 264, 48575, 21742, 389, 264, 2678, 11307, 79105, 13]	12	ok
676	Appraisal management companies oversee appraisers' fees under Dodd-Frank regulations.	[2213, 65359, 6373, 5220, 42003, 917, 41098, 388, 6, 12718, 1234, 84093, 7424, 13430, 14640, 13]	16	ok
677	Navigating owner financing options with a steep learning curve.	[99542, 1113, 6506, 29642, 2671, 449, 264, 32366, 6975, 16029, 13]	11	ok
678	Company pays $5,000 fine, adopts new fee schedule nationwide.	[14831, 21935, 400, 20, 11, 931, 7060, 11, 87057, 502, 11307, 9899, 29054, 13]	14	ok
679	Written statements are libel, spoken statements are slander.	[36724, 12518, 527, 3127, 301, 11, 22066, 12518, 527, 99558, 13]	11	ok
680	Defamation harms reputation through false written or spoken statements.	[2685, 27279, 84496, 17444, 1555, 905, 5439, 477, 22066, 12518, 13]	11	ok
681	Defamation is the communication of false statements harming reputation.	[2685, 27279, 374, 279, 10758, 315, 905, 12518, 90255, 17444, 13]	11	ok
682	Defamatory written or broadcast statements harm someone's reputation instantly.	[2685, 309, 5382, 5439, 477, 13195, 12518, 11682, 4423, 596, 17444, 22571, 13]	13	ok
683	Defamation basics cover slander and libel laws and regulations.	[2685, 27279, 32874, 3504, 99558, 323, 3127, 301, 7016, 323, 14640, 13]	12	ok
684	False statements harm others in various forms of media.	[4139, 12518, 11682, 3885, 304, 5370, 7739, 315, 3772, 13]	10	ok
685	Publisher's intent is key in libel cases, not knowledge.	[35650, 596, 7537, 374, 1401, 304, 3127, 301, 5157, 11, 539, 6677, 13]	13	ok
686	Libel is written defamation, slander is spoken.	[9374, 301, 374, 5439, 89201, 11, 99558, 374, 22066, 13]	10	ok
687	Defamation is a tort causing harm to someone's reputation online.	[2685, 27279, 374, 264, 16831, 14718, 11682, 311, 4423, 596, 17444, 2930, 13]	13	ok
688	Libel is written or printed defamation with lasting impact.	[9374, 301, 374, 5439, 477, 17124, 89201, 449, 29869, 5536, 13]	11	ok
689	Genital herpes is a common US sexually transmitted disease.	[10172, 2223, 70085, 374, 264, 4279, 2326, 27681, 34699, 8624, 13]	11	ok
690	HSV-1 causes cold sores and genital herpes through skin contact.	[100030, 12, 16, 11384, 9439, 779, 417, 323, 57455, 70085, 1555, 6930, 3729, 13]	14	ok
691	Herpes simplex viruses cause oral and genital infections worldwide.	[21364, 20975, 92751, 42068, 5353, 21308, 323, 57455, 30020, 15603, 13]	11	ok
692	HSV-1 and HSV-2 cause genital herpes infections differently.	[100030, 12, 16, 323, 81411, 12, 17, 5353, 57455, 70085, 30020, 22009, 13]	13	ok
693	Genital herpes symptoms include painful sores and skin irritation.	[10172, 2223, 70085, 13803, 2997, 26175, 779, 417, 323, 6930, 66510, 13]	12	ok
694	HPV is a common sexually transmitted virus with many types.	[6748, 53, 374, 264, 4279, 27681, 34699, 17188, 449, 1690, 4595, 13]	12	ok
695	HSV-2 causes most genital herpes infections worldwide.	[100030, 12, 17, 11384, 1455, 57455, 70085, 30020, 15603, 13]	10	ok
696	Genital herpes symptoms can be mistaken for other infections.	[10172, 2223, 70085, 13803, 649, 387, 37104, 369, 1023, 30020, 13]	11	ok
697	Genital herpes virus spreads through sexual contact without symptoms.	[10172, 2223, 70085, 17188, 43653, 1555, 7392, 3729, 2085, 13803, 13]	11	ok
698	Genital herpes causes painful sores and increases HIV risk.	[10172, 2223, 70085, 11384, 26175, 779, 417, 323, 12992, 23495, 5326, 13]	12	ok
699	Telekinesis lacks scientific evidence and proven existence.	[22378, 74, 83889, 37856, 12624, 6029, 323, 17033, 14209, 13]	10	ok
700	Learn to harness your mind's power for effortless movement.	[24762, 311, 33508, 701, 4059, 596, 2410, 369, 80192, 7351, 13]	11	ok
701	Learn to control objects with your mind through telekinesis practice.	[24762, 311, 2585, 6302, 449, 701, 4059, 1555, 8122, 74, 83889, 6725, 13]	13	ok
702	Master the art of telekinesis with PSI Wheel technique.	[18532, 279, 1989, 315, 8122, 74, 83889, 449, 89278, 33442, 15105, 13]	12	ok
703	Human telekinesis lies dormant due to centuries of mental suppression.	[35075, 8122, 74, 83889, 15812, 89460, 4245, 311, 24552, 315, 10723, 46735, 13]	13	ok
704	Learn to control objects with your mind through PSI Wheel training.	[24762, 311, 2585, 6302, 449, 701, 4059, 1555, 89278, 33442, 4967, 13]	12	ok
705	"Here are the nominal phrases with no repetition, at most 10 words and at least 6 words:

1. Overcoming regret through self-reflection and forgiveness is key always.
2. Lucid dreaming allows for mind control and exploration freely.
3. Humans ponder existence and meaning through introspective mental processes daily.
4. Nightmares symbolize anxiety and unresolved emotional issues deeply rooted.
5. Mindfulness meditation techniques calm the nervous system effectively always.
6. Nervous breakdowns signify emotional overwhelm and mental exhaustion severely."	[8586, 527, 279, 47855, 32847, 449, 912, 54515, 11, 520, 1455, 220, 605, 4339, 323, 520, 3325, 220, 21, 4339, 1473, 16, 13, 6193, 5065, 23023, 1555, 659, 44107, 1191, 323, 53150, 374, 1401, 2744, 627, 17, 13, 14103, 307, 56774, 6276, 369, 4059, 2585, 323, 27501, 26662, 627, 18, 13, 66094, 48883, 14209, 323, 7438, 1555, 26609, 9262, 10723, 11618, 7446, 627, 19, 13, 13120, 63636, 7891, 553, 18547, 323, 81261, 14604, 4819, 17693, 41976, 627, 20, 13, 23754, 31514, 33862, 12823, 19858, 279, 23418, 1887, 13750, 2744, 627, 21, 13, 452, 651, 788, 31085, 82, 89522, 14604, 96848, 323, 10723, 70663, 35906, 13]	105	problèmes de génération
706	Mind control through PSI Wheel meditation technique requires relaxation.	[70738, 2585, 1555, 89278, 33442, 33862, 15105, 7612, 43685, 13]	10	ok
707	Mastering telekinesis for beginners: harnessing brain power for effortless movement.	[18532, 287, 8122, 74, 83889, 369, 47950, 25, 33508, 287, 8271, 2410, 369, 80192, 7351, 13]	16	ok
708	Telekinesis is the alleged ability to move objects mentally.	[22378, 74, 83889, 374, 279, 10711, 5845, 311, 3351, 6302, 34325, 13]	12	ok
709	The Thermacell Mosquito Repellent is an effective outdoor device.	[791, 68372, 582, 616, 12847, 42196, 3402, 616, 306, 374, 459, 7524, 16166, 3756, 13]	15	ok
710	The ThermaCELL uses butane to heat mosquito repellent mats.	[791, 23258, 1764, 64655, 5829, 719, 2194, 311, 8798, 50646, 88874, 306, 62156, 13]	14	ok
711	Thermacell Mosquito Repellent is a portable kit accessory.	[1016, 4289, 582, 616, 12847, 42196, 3402, 616, 306, 374, 264, 23665, 16530, 43081, 13]	15	ok
712	ThermaCELL Mosquito Repellent: A Revolutionary Outdoor Solution Found.	[1016, 261, 1764, 64655, 12847, 42196, 3402, 616, 306, 25, 362, 67679, 33782, 12761, 12595, 13]	16	ok
713	ThermaCELL Mosquito Repellent provides effective bug-free outdoor experiences.	[1016, 261, 1764, 64655, 12847, 42196, 3402, 616, 306, 5825, 7524, 10077, 12862, 16166, 11704, 13]	16	ok
714	The ThermaCELL Mosquito Repellent Appliance provides effective mosquito protection.	[791, 23258, 1764, 64655, 12847, 42196, 3402, 616, 306, 5345, 32712, 5825, 7524, 50646, 9313, 13]	16	ok
715	The ThermaCELL Mosquito Repeller is a compact device.	[791, 23258, 1764, 64655, 12847, 42196, 3402, 7218, 374, 264, 17251, 3756, 13]	13	ok
716	Use Thermacell Mosquito Repellent to prevent West Nile virus transmission.	[10464, 68372, 582, 616, 12847, 42196, 3402, 616, 306, 311, 5471, 4410, 77290, 17188, 18874, 13]	16	ok
717	The Thermacell Mosquito Repellent uses butane to heat insecticide.	[791, 68372, 582, 616, 12847, 42196, 3402, 616, 306, 5829, 719, 2194, 311, 8798, 27080, 14842, 13]	17	ok
718	Thermacell Mosquito Repellent includes three mats and butane cartridge.	[1016, 4289, 582, 616, 12847, 42196, 3402, 616, 306, 5764, 2380, 62156, 323, 719, 2194, 51962, 13]	17	ok
719	Review key concepts before taking the ACCUPLACER test.	[19997, 1401, 19476, 1603, 4737, 279, 26925, 52, 2989, 1741, 643, 1296, 13]	13	ok
720	Remote test center access granted with COMPASS registration number.	[25732, 1296, 4219, 2680, 11938, 449, 22735, 5045, 12506, 1396, 13]	11	ok
721	Unlocking account requires matching security question answers.	[50779, 287, 2759, 7612, 12864, 4868, 3488, 11503, 13]	9	ok
722	ACCUPLACER ensures fair and accessible testing for diverse students.	[1741, 17218, 2989, 1741, 643, 26420, 6762, 323, 15987, 7649, 369, 17226, 4236, 13]	14	ok
723	Calculators allowed on certain math tests with specific requirements.	[59008, 3046, 5535, 389, 3738, 7033, 7177, 449, 3230, 8670, 13]	11	ok
724	The COMPASS test is a self-adjusting, computer-based assessment tool.	[791, 22735, 5045, 1296, 374, 264, 659, 60684, 287, 11, 6500, 6108, 15813, 5507, 13]	15	ok
725	COMPASS placement test assesses readiness for college classes effectively.	[24637, 5045, 22165, 1296, 8720, 288, 62792, 369, 7926, 6989, 13750, 13]	12	ok
726	Waiting before taking ACCUPLACER yields better results apparently.	[43204, 1603, 4737, 26925, 52, 2989, 1741, 643, 36508, 2731, 3135, 14132, 13]	13	ok
727	COMPASS is a computer-adaptive test assessing reading, writing, and math skills.	[24637, 5045, 374, 264, 6500, 26831, 28881, 1296, 47614, 5403, 11, 4477, 11, 323, 7033, 7512, 13]	17	ok
728	Take a math placement test before enrolling in higher-level math courses.	[18293, 264, 7033, 22165, 1296, 1603, 665, 16608, 304, 5190, 11852, 7033, 14307, 13]	14	ok
729	"Here is a nominal phrase with no repetition, at most 10 words and at least 6 words:

""Understanding Periodic Table Groups and Their Properties and Trends."""	[8586, 374, 264, 47855, 17571, 449, 912, 54515, 11, 520, 1455, 220, 605, 4339, 323, 520, 3325, 220, 21, 4339, 1473, 1, 71251, 26572, 292, 6771, 35680, 323, 11205, 12094, 323, 50730, 1210]	33	problèmes de génération
730	Oxygen's atomic structure maintains neutrality with 8 protons and electrons.	[46, 19472, 596, 25524, 6070, 33095, 52864, 449, 220, 23, 463, 35511, 323, 57678, 13]	15	ok
731	Elements are classified into groups and periods in the table.	[12132, 527, 21771, 1139, 5315, 323, 18852, 304, 279, 2007, 13]	11	ok
732	"Here is a nominal phrase with 10 words or more, and no repetition:

""Chemical properties are influenced by outermost electron shell configurations naturally."""	[8586, 374, 264, 47855, 17571, 449, 220, 605, 4339, 477, 810, 11, 323, 912, 54515, 1473, 1, 64938, 950, 6012, 527, 28160, 555, 16335, 3646, 17130, 12811, 33483, 18182, 1210]	30	problèmes de génération
733	"Here is a nominal phrase with no repetition, at most 10 words, and at least 6 words:

Periodic trends show varying properties across the periodic table."	[8586, 374, 264, 47855, 17571, 449, 912, 54515, 11, 520, 1455, 220, 605, 4339, 11, 323, 520, 3325, 220, 21, 4339, 1473, 24684, 292, 18845, 1501, 29865, 6012, 4028, 279, 39445, 2007, 13]	33	problèmes de génération
734	Periodic table groups are columns of chemical elements.	[24684, 292, 2007, 5315, 527, 8310, 315, 11742, 5540, 13]	10	ok
735	Chemical elements are grouped by similar electron shell characteristics.	[64938, 950, 5540, 527, 41141, 555, 4528, 17130, 12811, 17910, 13]	11	ok
736	Periodic table displays elements in predictable group and period patterns.	[24684, 292, 2007, 19207, 5540, 304, 45207, 1912, 323, 4261, 12912, 13]	12	ok
737	"Here is a summary in 7 words: 
Math questions about calculus and physics concepts."	[8586, 374, 264, 12399, 304, 220, 22, 4339, 25, 720, 8991, 4860, 922, 83768, 323, 22027, 19476, 13]	18	problèmes de génération
738	Elements in groups exhibit similar chemical properties.	[12132, 304, 5315, 31324, 4528, 11742, 6012, 13]	8	autre
739	Archduke Franz Ferdinand assassinated in Sarejevo by Gavrilo Princip.	[19249, 1072, 441, 66620, 93607, 26816, 15846, 304, 328, 548, 3841, 3415, 555, 480, 70684, 18536, 45629, 13]	18	ok
740	Archduke Franz Ferdinand assassinated in Sarajevo on June 28, 1914.	[19249, 1072, 441, 66620, 93607, 26816, 15846, 304, 13951, 11305, 3415, 389, 5651, 220, 1591, 11, 220, 7529, 19, 13]	20	ok
741	Archduke Franz Ferdinand assassinated in Sarajevo on June 28, 1914.	[19249, 1072, 441, 66620, 93607, 26816, 15846, 304, 13951, 11305, 3415, 389, 5651, 220, 1591, 11, 220, 7529, 19, 13]	20	ok
742	Archduke's assassination sparked World War I's complex regional tensions.	[19249, 1072, 441, 596, 49417, 41544, 4435, 5111, 358, 596, 6485, 15481, 39510, 13]	14	ok
743	Gavrilo Princip sparked World War I with his assassination.	[38, 70684, 18536, 45629, 41544, 4435, 5111, 358, 449, 813, 49417, 13]	12	ok
744	Bosnian Serbs honor Gavrilo Princip, archduke assassin and nationalist.	[33, 437, 77, 1122, 8409, 1302, 16044, 480, 70684, 18536, 45629, 11, 5438, 1072, 441, 68769, 323, 52994, 13]	19	ok
745	Austria's royal succession sparked international concern and diplomatic turmoil.	[32, 85912, 596, 30336, 50787, 41544, 6625, 4747, 323, 34616, 63355, 13]	12	ok
746	Gavrilo Princip's actions sparked World War I's devastating global conflict.	[38, 70684, 18536, 45629, 596, 6299, 41544, 4435, 5111, 358, 596, 33318, 3728, 12324, 13]	15	ok
747	Archduke's assassination sparked World War I's devastating global conflict.	[19249, 1072, 441, 596, 49417, 41544, 4435, 5111, 358, 596, 33318, 3728, 12324, 13]	14	ok
748	Archduke Franz Ferdinand's assassination attempt failed miserably in Sarajevo.	[19249, 1072, 441, 66620, 93607, 596, 49417, 4879, 4745, 98310, 2915, 304, 13951, 11305, 3415, 13]	16	ok
749	Follow label instructions for proper dosage and age considerations.	[12763, 2440, 11470, 369, 6300, 47040, 323, 4325, 38864, 13]	10	ok
750	High acetaminophen levels pose liver damage risk.	[12243, 65802, 8778, 5237, 268, 5990, 17477, 26587, 5674, 5326, 13]	11	ok
751	Acetaminophen overdose poses liver damage risk at high levels.	[11916, 295, 8778, 5237, 268, 60553, 34103, 26587, 5674, 5326, 520, 1579, 5990, 13]	14	ok
752	Acetaminophen blood test screens for common pain reliever presence.	[11916, 295, 8778, 5237, 268, 6680, 1296, 15670, 369, 4279, 6784, 59644, 424, 9546, 13]	15	ok
753	Administer liquid medication with care and precision daily.	[7358, 1601, 14812, 24099, 449, 2512, 323, 16437, 7446, 13]	10	ok
754	Acetaminophen dosage ranges from 15 mg to 4000 mg.	[11916, 295, 8778, 5237, 268, 47040, 21986, 505, 220, 868, 14060, 311, 220, 3443, 15, 14060, 13]	17	ok
755	Acetaminophen overdose can be treated promptly for recovery.	[11916, 295, 8778, 5237, 268, 60553, 649, 387, 12020, 40522, 369, 13654, 13]	13	ok
756	Acetaminophen blood test diagnoses overdosage and liver damage.	[11916, 295, 8778, 5237, 268, 6680, 1296, 85488, 40552, 437, 425, 323, 26587, 5674, 13]	15	ok
757	Use the provided dropper for accurate dosage.	[10464, 279, 3984, 7118, 7067, 369, 13687, 47040, 13]	9	ok
758	Acetaminophen overdose risk increases with excessive daily intake.	[11916, 295, 8778, 5237, 268, 60553, 5326, 12992, 449, 27639, 7446, 23730, 13]	13	ok
759	Manteca has high population density compared to state and nation.	[44, 519, 23637, 706, 1579, 7187, 17915, 7863, 311, 1614, 323, 7140, 13]	13	ok
760	Manteca, California, a small industrial city in the US.	[44, 519, 23637, 11, 7188, 11, 264, 2678, 13076, 3363, 304, 279, 2326, 13]	14	ok
761	Manteca, CA employment rates show significant labor force participation.	[44, 519, 23637, 11, 9362, 14740, 7969, 1501, 5199, 9511, 5457, 20852, 13]	13	ok
762	Staff meet seniors for coffee and conversation every Wednesday.	[34311, 3449, 38349, 369, 11033, 323, 10652, 1475, 8079, 13]	10	ok
763	Manteca is one of California's most rapidly growing cities.	[44, 519, 23637, 374, 832, 315, 7188, 596, 1455, 19019, 7982, 9919, 13]	13	ok
764	Manteca, California has a high sex offender ratio and taxes.	[44, 519, 23637, 11, 7188, 706, 264, 1579, 1877, 47753, 11595, 323, 13426, 13]	14	ok
765	Manteca's population is significantly larger than the US average.	[44, 519, 23637, 596, 7187, 374, 12207, 8294, 1109, 279, 2326, 5578, 13]	13	ok
766	Manteca's unmarried youth reside in various household arrangements.	[44, 519, 23637, 596, 95587, 12822, 48383, 304, 5370, 14048, 28904, 13]	12	ok
767	The U.S. Census Bureau conducts a comprehensive economic census annually.	[791, 549, 815, 13, 46627, 22555, 74198, 264, 16195, 7100, 44702, 30171, 13]	13	ok
768	Manteca, California has a population of approximately 76,908 residents.	[44, 519, 23637, 11, 7188, 706, 264, 7187, 315, 13489, 220, 4767, 11, 23629, 11062, 13]	16	ok
769	Heart rate is the number of heartbeats per minute measured.	[46484, 4478, 374, 279, 1396, 315, 4851, 1395, 1900, 824, 9568, 17303, 13]	13	ok
770	Vibrant visuals transform any space into a dynamic party atmosphere.	[53, 10892, 519, 54077, 5276, 904, 3634, 1139, 264, 8915, 4717, 16975, 13]	13	ok
771	Heart rate monitoring detects heart function and potential issues.	[46484, 4478, 16967, 67578, 4851, 734, 323, 4754, 4819, 13]	10	ok
772	Measuring pulse reveals heart rhythm and vital health indicators.	[7979, 69774, 28334, 21667, 4851, 37390, 323, 16595, 2890, 34824, 13]	11	ok
773	Blood pressure is the force exerted by the heart.	[52586, 7410, 374, 279, 5457, 43844, 291, 555, 279, 4851, 13]	11	ok
774	JBL Connect enables multi-speaker harmony for enhanced audio experience.	[41, 9574, 13313, 20682, 7447, 54075, 4506, 26348, 369, 24872, 7855, 3217, 13]	13	ok
775	Pulse 2 features advanced speakerphone technology for clear calls.	[47, 17660, 220, 17, 4519, 11084, 19114, 4949, 5557, 369, 2867, 6880, 13]	13	ok
776	Allergic reaction persists until pulse returns to normal rate.	[2460, 75439, 13010, 67145, 3156, 28334, 4780, 311, 4725, 4478, 13]	11	ok
777	Pulse checks help diagnose heart function and potential issues.	[47, 17660, 12621, 1520, 58681, 4851, 734, 323, 4754, 4819, 13]	11	ok
778	Heart rate is a vital sign of cardiovascular function normally.	[46484, 4478, 374, 264, 16595, 1879, 315, 41713, 734, 14614, 13]	11	ok
779	Accidental death benefit provides coverage for unexpected bodily harm.	[14945, 62723, 4648, 8935, 5825, 10401, 369, 16907, 48131, 11682, 13]	11	ok
780	Flexible life insurance policy with adaptable terms and conditions.	[76247, 2324, 8276, 4947, 449, 94848, 3878, 323, 4787, 13]	10	ok
781	Financial interest in another person's life or well-being exists.	[57330, 2802, 304, 2500, 1732, 596, 2324, 477, 1664, 33851, 6866, 13]	12	ok
782	Insurance agency solicits, writes, and binds policies through multiple insurers.	[79854, 9266, 30844, 1220, 11, 14238, 11, 323, 58585, 10396, 1555, 5361, 56374, 13]	14	ok
783	Insurance terminology explained in a quick reference guide.	[79854, 57726, 11497, 304, 264, 4062, 5905, 8641, 13]	9	ok
784	Insurance provides financial protection against uncertain losses and risks.	[79854, 5825, 6020, 9313, 2403, 36218, 18151, 323, 15635, 13]	10	ok
785	Insurance provides financial protection against specified risks and uncertainties.	[79854, 5825, 6020, 9313, 2403, 5300, 15635, 323, 69867, 13]	10	ok
786	Flexible life insurance with adjustable terms and adjuster services.	[76247, 2324, 8276, 449, 37030, 3878, 323, 7652, 261, 3600, 13]	11	ok
787	Federal employees access comprehensive insurance benefits through OPM and NGA.	[57853, 8420, 2680, 16195, 8276, 7720, 1555, 507, 8971, 323, 452, 16519, 13]	13	ok
788	Insurance agency definition and differences to be reviewed.	[79854, 9266, 7419, 323, 12062, 311, 387, 22690, 13]	9	ok
789	Clearwater Beach tops TripAdvisor's annual U.S. beach rankings again.	[14335, 13284, 13011, 33522, 85066, 596, 9974, 549, 815, 13, 11573, 33407, 1578, 13]	14	ok
790	Clearwater Beach named top US beach by TripAdvisor awards.	[14335, 13284, 13011, 7086, 1948, 2326, 11573, 555, 85066, 23146, 13]	11	ok
791	Bahia Honda State Park boasts pristine white sandy beaches.	[100022, 689, 29987, 3314, 5657, 38119, 66085, 4251, 68539, 35909, 13]	11	ok
792	Bahia Honda State Park is a Florida Keys gem.	[100022, 689, 29987, 3314, 5657, 374, 264, 9784, 25104, 19269, 13]	11	ok
793	Amazon gift card delivery via email after TripAdvisor review confirmation.	[26948, 8352, 3786, 9889, 4669, 2613, 1306, 85066, 3477, 20109, 13]	11	ok
794	Eligible bookings must be made by September 5, 2016, and reviewed by October 15, 2016.	[6719, 343, 1260, 59620, 2011, 387, 1903, 555, 6250, 220, 20, 11, 220, 679, 21, 11, 323, 22690, 555, 6664, 220, 868, 11, 220, 679, 21, 13]	27	autre
795	TripAdvisor gift card delivery after review publication confirmed stay.	[57452, 62091, 8352, 3786, 9889, 1306, 3477, 17009, 11007, 4822, 13]	11	ok
796	America boasts numerous stunning beaches nationwide, showcasing diverse natural beauty.	[32132, 38119, 12387, 20441, 35909, 29054, 11, 67908, 17226, 5933, 13444, 13]	12	ok
797	Top 25 US Beaches, a haven for sun-seekers nationwide.	[5479, 220, 914, 2326, 13011, 288, 11, 264, 9167, 369, 7160, 7962, 1247, 388, 29054, 13]	16	ok
798	Florida's Gulf Coast beaches shine with notable East Coast recognition.	[58127, 596, 27945, 16377, 35909, 33505, 449, 28289, 6460, 16377, 18324, 13]	12	ok
799	Understanding late Rome's complex nature and barbarian invasions led downfall.	[71251, 3389, 22463, 596, 6485, 7138, 323, 54490, 1122, 1558, 88771, 6197, 88867, 13]	14	ok
800	Historians still debate the Roman Empire's downfall extensively today.	[50083, 5493, 2103, 11249, 279, 13041, 21080, 596, 88867, 42817, 3432, 13]	12	ok
801	Roman Empire's decline began in the 3rd century AD slowly.	[62080, 21080, 596, 18174, 6137, 304, 279, 220, 18, 6634, 9478, 9827, 14297, 13]	14	ok
802	Roman Empire's influence waned despite nominal control of Mediterranean territories.	[62080, 21080, 596, 10383, 289, 52530, 8994, 47855, 2585, 315, 38785, 39543, 13]	13	ok
803	The Roman Empire was a dominant global power historically.	[791, 13041, 21080, 574, 264, 25462, 3728, 2410, 35901, 13]	10	ok
804	Rome's decline marked the end of its European dominance.	[49, 638, 596, 18174, 13160, 279, 842, 315, 1202, 7665, 44592, 13]	12	ok
805	Roman Empire endured for nearly 1,500 years of relative peace.	[62080, 21080, 56224, 369, 7154, 220, 16, 11, 2636, 1667, 315, 8844, 9096, 13]	14	ok
806	Eastern Roman emperors unified taxation across the vast empire territories.	[97488, 13041, 991, 716, 1105, 43790, 51727, 4028, 279, 13057, 32447, 39543, 13]	13	ok
807	Rome's population peaked at 50-90 million inhabitants around 500 AD.	[49, 638, 596, 7187, 78292, 520, 220, 1135, 12, 1954, 3610, 40771, 2212, 220, 2636, 9827, 13]	17	ok
808	Roman Empire's decline began in the 3rd century AD slowly.	[62080, 21080, 596, 18174, 6137, 304, 279, 220, 18, 6634, 9478, 9827, 14297, 13]	14	ok
809	Lodi's sex offender ratio is near state average, taxes are high.	[43, 31559, 596, 1877, 47753, 11595, 374, 3221, 1614, 5578, 11, 13426, 527, 1579, 13]	15	ok
