323	Jill St. John's iconic 1960s film presence remains captivating still.	[41, 484, 800, 13, 3842, 596, 27373, 220, 5162, 15, 82, 4632, 9546, 8625, 86282, 2103, 13]	17	ok
324	Walter Winchell exposes Hollywood romance between Jill St. John and Bob Evans.	[54, 38377, 12468, 331, 616, 59381, 17681, 30363, 1990, 48311, 800, 13, 3842, 323, 14596, 30563, 13]	17	ok
325	Jill St. John's notable film roles span multiple genres briefly.	[41, 484, 800, 13, 3842, 596, 28289, 4632, 13073, 9575, 5361, 36744, 27851, 13]	14	ok
326	Marti Rulli's novel explores Dennis Davern's journey and belonging.	[44, 68641, 432, 620, 72, 596, 11775, 41424, 35727, 5460, 944, 596, 11879, 323, 33152, 13]	16	ok
327	Harrison's friend Bob Neal seeks Jill St. John's attention.	[39, 51103, 596, 4333, 14596, 66549, 26737, 48311, 800, 13, 3842, 596, 6666, 13]	14	ok
328	Robert Wagner marries Jill St. John after eight years of grief.	[35632, 52475, 3678, 4108, 48311, 800, 13, 3842, 1306, 8223, 1667, 315, 38384, 13]	14	ok
329	FDR's first 100 days in office were highly productive.	[37, 7842, 596, 1176, 220, 1041, 2919, 304, 5274, 1051, 7701, 27331, 13]	13	ok
330	Dust Bowl disaster resulted from agricultural practices during economic downturn.	[35, 592, 20904, 21426, 19543, 505, 29149, 12659, 2391, 7100, 76506, 13]	12	ok
331	Devastating drought led to mass migration of Great Plains residents.	[14934, 561, 1113, 37846, 6197, 311, 3148, 12172, 315, 8681, 63911, 11062, 13]	13	ok
332	Drought and intensive farming practices led to devastating consequences.	[35, 6478, 323, 37295, 33489, 12659, 6197, 311, 33318, 16296, 13]	11	ok
333	Drought led to devastating economic hardship in the region.	[35, 6478, 6197, 311, 33318, 7100, 67650, 304, 279, 5654, 13]	11	ok
334	Dryland farming techniques can mitigate agricultural devastation effectively worldwide.	[86315, 1974, 33489, 12823, 649, 50460, 29149, 83015, 13750, 15603, 13]	11	ok
335	Drought and agricultural practices led to devastating Dust Bowl consequences.	[35, 6478, 323, 29149, 12659, 6197, 311, 33318, 33093, 20904, 16296, 13]	12	ok
336	The American colonists listed grievances against British rule.	[791, 3778, 15235, 1705, 10212, 88036, 2403, 8013, 6037, 13]	10	ok
337	Caused by toxic chemical dumping and severe drought conditions.	[23389, 2656, 555, 21503, 11742, 61682, 323, 15748, 37846, 4787, 13]	11	ok
338	The Great Depression and drought were primary contributing factors.	[791, 8681, 46904, 323, 37846, 1051, 6156, 29820, 9547, 13]	10	ok
339	File types and size restrictions apply for uploads.	[1738, 4595, 323, 1404, 17294, 3881, 369, 67663, 13]	9	ok
340	Mastering Tahitian and French phrases for culinary exploration abroad.	[18532, 287, 58087, 79544, 323, 8753, 32847, 369, 58441, 27501, 22917, 13]	12	ok
341	Rarotongan is a Polynesian language spoken in Cook Islands.	[49, 277, 354, 83388, 374, 264, 3735, 1910, 30321, 4221, 22066, 304, 12797, 23028, 13]	15	ok
342	File upload format and size restrictions apply strictly.	[1738, 8298, 3645, 323, 1404, 17294, 3881, 26549, 13]	9	ok
343	File size and format restrictions apply to uploads.	[1738, 1404, 323, 3645, 17294, 3881, 311, 67663, 13]	9	ok
344	File upload restrictions apply to specific file types and sizes.	[1738, 8298, 17294, 3881, 311, 3230, 1052, 4595, 323, 12562, 13]	11	ok
345	Learning Tahitian phrases enhances Polynesian rapport and eases interactions.	[48567, 58087, 79544, 32847, 57924, 3735, 1910, 30321, 39474, 323, 384, 2315, 22639, 13]	14	ok
346	File size and format restrictions apply to uploads.	[1738, 1404, 323, 3645, 17294, 3881, 311, 67663, 13]	9	ok
347	Tahitian and French are the official island languages predominantly spoken.	[51, 1494, 79544, 323, 8753, 527, 279, 4033, 13218, 15823, 47904, 22066, 13]	13	ok
348	Mastering Tahitian and French phrases enhances island interactions greatly overseas.	[18532, 287, 58087, 79544, 323, 8753, 32847, 57924, 13218, 22639, 19407, 25355, 13]	13	ok
349	Phase changes involve heat absorption or release.	[31833, 4442, 21736, 8798, 44225, 477, 4984, 13]	8	autre
350	Melting and boiling points define phase transitions in substances.	[40249, 1303, 323, 50937, 3585, 7124, 10474, 34692, 304, 33155, 13]	11	ok
351	American Chemical Society offers free online chemistry lessons for middle school.	[29518, 36424, 13581, 6209, 1949, 2930, 30903, 18872, 369, 6278, 2978, 13]	12	ok
352	Sublimation is a physical state change, not chemical reaction.	[3214, 4763, 367, 374, 264, 7106, 1614, 2349, 11, 539, 11742, 13010, 13]	13	ok
353	Sublimation occurs when a solid transforms directly into gas.	[3214, 4763, 367, 13980, 994, 264, 6573, 29575, 6089, 1139, 6962, 13]	12	ok
354	Evaporation occurs at water's surface, temperature influences its rate.	[35212, 96649, 13980, 520, 3090, 596, 7479, 11, 9499, 34453, 1202, 4478, 13]	13	ok
355	Solid to gas transition occurs with heat absorption.	[47041, 311, 6962, 9320, 13980, 449, 8798, 44225, 13]	9	ok
356	Changes of state involve evaporation, condensation, sublimation, freezing, and melting.	[11569, 315, 1614, 21736, 3721, 96649, 11, 9955, 42725, 11, 1207, 4763, 367, 11, 43318, 11, 323, 50684, 13]	19	ok
357	Condensation occurs when water vapor cools and transforms into liquid water.	[50796, 42725, 13980, 994, 3090, 38752, 1080, 3145, 323, 29575, 1139, 14812, 3090, 13]	14	ok
358	States of matter change with heat absorption and release.	[24137, 315, 5030, 2349, 449, 8798, 44225, 323, 4984, 13]	10	ok
359	Dr. Antonio Ramada, a renowned medical professional, is available on Healthgrades.	[9023, 13, 23245, 15504, 2649, 11, 264, 37048, 6593, 6721, 11, 374, 2561, 389, 6401, 23142, 13]	17	ok
360	Ramada Plaza-Hagerstown hotel near I-81 and downtown Hagerstown attractions.	[64948, 2649, 41407, 11529, 1435, 44058, 9689, 3221, 358, 12, 5932, 323, 19441, 473, 1435, 44058, 39591, 13]	18	ok
361	Hospital quality significantly impacts heart bypass surgery outcomes greatly.	[82566, 4367, 12207, 25949, 4851, 31818, 15173, 20124, 19407, 13]	10	ok
362	Dr. Marco Lopez Sr., MD, shares patient insights online.	[9023, 13, 35281, 45315, 34688, 2637, 14306, 11, 13551, 8893, 26793, 2930, 13]	13	ok
363	NPI number 1578763462 belongs to female doctor Letitia Poret MD PA.	[45, 1932, 1396, 220, 10895, 24870, 18061, 17, 17623, 311, 8954, 10896, 6914, 88575, 393, 18673, 14306, 13174, 13]	19	ok
364	NIDA A Guerra-Cavazos is a female physician.	[45, 52271, 362, 4673, 14210, 7813, 402, 1394, 437, 374, 264, 8954, 28378, 13]	14	ok
365	Invalid link entered for Dr. Ramada, please re-enter the link.	[8087, 2723, 10862, 369, 2999, 13, 15504, 2649, 11, 4587, 312, 49315, 279, 2723, 13]	15	ok
366	Get information about Dr. Leticia A Poret MD PA owner details.	[1991, 2038, 922, 2999, 13, 445, 5411, 689, 362, 393, 18673, 14306, 13174, 6506, 3649, 13]	16	ok
367	NPI number details available in PDF and text formats.	[45, 1932, 1396, 3649, 2561, 304, 11612, 323, 1495, 20447, 13]	11	ok
368	Hospital rating significantly impacts heart bypass surgery outcomes greatly.	[82566, 10959, 12207, 25949, 4851, 31818, 15173, 20124, 19407, 13]	10	ok
369	Koepka family history and genealogy resources are available online.	[42, 78, 752, 4657, 3070, 3925, 323, 15207, 80378, 5070, 527, 2561, 2930, 13]	14	ok
370	Brooks Koepka is a top-ranked American professional golfer overseas.	[27368, 35322, 30417, 752, 4657, 374, 264, 1948, 76697, 3778, 6721, 45549, 809, 25355, 13]	15	ok
371	Originating from Old English, the surname Born dates back centuries.	[13601, 1113, 505, 10846, 6498, 11, 279, 40853, 38916, 13003, 1203, 24552, 13]	13	ok
372	Indexing record collections can be challenging and frustrating sometimes.	[1581, 287, 3335, 15661, 649, 387, 17436, 323, 35711, 7170, 13]	11	ok
373	North still uses burn for a stream, often originating from a place.	[26287, 2103, 5829, 8395, 369, 264, 4365, 11, 3629, 71373, 505, 264, 2035, 13]	14	ok
374	Re-testing DNA for genealogy can yield new connections.	[697, 83255, 15922, 369, 15207, 80378, 649, 7692, 502, 13537, 13]	11	ok
375	Originating from Anglo-Saxon roots, the surname Born dates back centuries.	[13601, 1113, 505, 60259, 6354, 52936, 20282, 11, 279, 40853, 38916, 13003, 1203, 24552, 13]	15	ok
376	Brooks Koepka finishes T9 at Travelers Championship.	[27368, 35322, 30417, 752, 4657, 34136, 350, 24, 520, 18589, 388, 19134, 13]	13	ok
377	New resources enhance Koepka ancestry research efforts significantly worldwide.	[3648, 5070, 18885, 30417, 752, 4657, 66004, 3495, 9045, 12207, 15603, 13]	12	ok
378	Koepka's early life and amateur golf career began in Florida.	[42, 78, 752, 4657, 596, 4216, 2324, 323, 19077, 19665, 7076, 6137, 304, 9784, 13]	15	ok
379	Orchestral composition encompasses diverse musical elements and instrumentation.	[2244, 27417, 3545, 18528, 71010, 17226, 18273, 5540, 323, 78133, 13]	11	ok
380	Classical music follows tonal key schemes and harmonic patterns.	[1999, 950, 4731, 11263, 8941, 278, 1401, 31956, 323, 82341, 12912, 13]	12	ok
381	Composers varied in symphony structure and movement count.	[1110, 981, 388, 28830, 304, 8045, 30748, 6070, 323, 7351, 1797, 13]	12	ok
382	Symphony structure varies, with contrasting tempo and emotional depth.	[29012, 30748, 6070, 35327, 11, 449, 75055, 24108, 323, 14604, 8149, 13]	12	ok
383	Percussion group underscores existential themes with distinct rhythmic pulse.	[47, 3035, 17861, 1912, 72890, 67739, 22100, 449, 12742, 29171, 21914, 28334, 13]	13	ok
384	Sonata form is a musical structure used in orchestral works.	[46714, 460, 1376, 374, 264, 18273, 6070, 1511, 304, 70984, 3545, 4375, 13]	13	ok
385	Orchestras combine diverse instruments for classical music performances.	[2244, 27417, 13075, 16343, 17226, 24198, 369, 29924, 4731, 24601, 13]	11	ok
386	Symphonic poem surpassed symphony as leading large-scale instrumental form.	[29012, 764, 14338, 33894, 68328, 8045, 30748, 439, 6522, 3544, 13230, 42045, 1376, 13]	14	ok
387	Understanding Beethoven's genius lies beyond initial musical notes and structure.	[71251, 2893, 93622, 596, 35201, 15812, 7953, 2926, 18273, 8554, 323, 6070, 13]	13	ok
388	Haydn, Mozart, and Beethoven shaped classical symphonic music.	[57564, 17851, 11, 95769, 11, 323, 2893, 93622, 27367, 29924, 8045, 764, 14338, 4731, 13]	15	ok
389	"The word ""convict"" exposes error, often with a rebuking tone."	[791, 3492, 330, 12296, 858, 1, 59381, 1493, 11, 3629, 449, 264, 12646, 3178, 287, 16630, 13]	17	problèmes de génération
390	"The word ""anothen"" likely means ""from above"" in biblical context."	[791, 3492, 330, 5770, 3473, 1, 4461, 3445, 330, 1527, 3485, 1, 304, 53640, 2317, 13]	16	problèmes de génération
391	"The NASU translators used parakaleo for ""comfort"" in various translations."	[791, 16473, 52, 73804, 1511, 1370, 587, 1604, 78, 369, 330, 19975, 1, 304, 5370, 37793, 13]	17	problèmes de génération
392	Elegxo occurs in 16:9, involving showing someone their guiltiness.	[36, 1978, 41922, 13980, 304, 220, 845, 25, 24, 11, 16239, 9204, 4423, 872, 34951, 1918, 13]	17	ok
393	Luke 8:41 is misinterpreted as an invitation.	[59447, 220, 23, 25, 3174, 374, 5906, 94561, 439, 459, 29788, 13]	12	ok
394	Jesus' triumphant entry into Jerusalem marked a pivotal moment.	[55065, 6, 92906, 28022, 4441, 1139, 26523, 13160, 264, 60850, 4545, 13]	12	ok
395	The word elegxo conveys shame and conviction beyond mere exposure.	[791, 3492, 18190, 41922, 390, 50369, 21648, 323, 29191, 7953, 17983, 14675, 13]	13	ok
396	Previous usage was at 13:10, contrasting with 15:5 context.	[21994, 10648, 574, 520, 220, 1032, 25, 605, 11, 75055, 449, 220, 868, 25, 20, 2317, 13]	17	ok
397	Jesus' teachings would be conveyed through the Holy Spirit.	[55065, 6, 45572, 1053, 387, 73897, 1555, 279, 19229, 17326, 13]	11	ok
398	Personal holiness vs positional holiness in biblical context.	[35127, 24429, 1918, 6296, 68647, 24429, 1918, 304, 53640, 2317, 13]	11	ok
399	Latrobe, Pennsylvania's population statistics are available online.	[24015, 33936, 11, 20355, 596, 7187, 13443, 527, 2561, 2930, 13]	11	ok
400	Latrobe's population demographics differ significantly from Pennsylvania's.	[24015, 33936, 596, 7187, 63334, 1782, 12207, 505, 20355, 596, 13]	11	ok
401	Latrobe's population is predominantly white, with a small Hispanic minority.	[24015, 33936, 596, 7187, 374, 47904, 4251, 11, 449, 264, 2678, 41985, 23413, 13]	14	ok
402	Demographic data and projections for Latrobe neighborhood.	[33103, 12968, 828, 323, 41579, 369, 10128, 33936, 12818, 13]	10	ok
403	Latrobe, PA has a population of 8,237 residents overall.	[24015, 33936, 11, 13174, 706, 264, 7187, 315, 220, 23, 11, 14590, 11062, 8244, 13]	15	ok
404	Latrobe residents predominantly hail from Pennsylvania and speak English.	[24015, 33936, 11062, 47904, 65350, 505, 20355, 323, 6604, 6498, 13]	11	ok
405	Latrobe has a population of 8,086 in Pennsylvania.	[24015, 33936, 706, 264, 7187, 315, 220, 23, 11, 26956, 304, 20355, 13]	13	ok
406	Latrobe has a low Hispanic population percentage of 0.3%.	[24015, 33936, 706, 264, 3428, 41985, 7187, 11668, 315, 220, 15, 13, 18, 14697]	14	ok
407	Latrobe, Pennsylvania's population statistics are detailed online now.	[24015, 33936, 11, 20355, 596, 7187, 13443, 527, 11944, 2930, 1457, 13]	12	ok
408	"Latrobe, Pennsylvania's population demographics underwent significant changes between 2000 and 2010.

According to the US Census Bureau, the population of Latrobe, PA in 2000 was approximately 9,366. In 2010, the population had decreased to around 9,114. 

Demographically, the population of Latrobe in 2000 was predominantly White, with 97.4% of the population identifying as White. In contrast, the 2010 census reported a decrease in the White population to 95.6%. 

The age distribution of Latrobe's population also shifted, with a decrease in the 65 and over age group from 21.1% in 2000 to 20.6%"	[24015, 33936, 11, 20355, 596, 7187, 63334, 55093, 5199, 4442, 1990, 220, 1049, 15, 323, 220, 679, 15, 382, 11439, 311, 279, 2326, 46627, 22555, 11, 279, 7187, 315, 10128, 33936, 11, 13174, 304, 220, 1049, 15, 574, 13489, 220, 24, 11, 18044, 13, 763, 220, 679, 15, 11, 279, 7187, 1047, 25983, 311, 2212, 220, 24, 11, 8011, 13, 4815, 33103, 65031, 11, 279, 7187, 315, 10128, 33936, 304, 220, 1049, 15, 574, 47904, 5929, 11, 449, 220, 3534, 13, 19, 4, 315, 279, 7187, 25607, 439, 5929, 13, 763, 13168, 11, 279, 220, 679, 15, 44702, 5068, 264, 18979, 304, 279, 5929, 7187, 311, 220, 2721, 13, 21, 14697, 4815, 791, 4325, 8141, 315, 10128, 33936, 596, 7187, 1101, 30073, 11, 449, 264, 18979, 304, 279, 220, 2397, 323, 927, 4325, 1912, 505, 220, 1691, 13, 16, 4, 304, 220, 1049, 15, 311, 220, 508, 13, 21, 4]	150	problèmes de génération
409	Sherman Poppen invents the first snowboard in 1965.	[68359, 1543, 10466, 2821, 17459, 82, 279, 1176, 12056, 2541, 304, 220, 5162, 20, 13]	15	ok
410	Jack Burchett invented a snowboard-like sled in 1929 initially.	[33731, 426, 2639, 7211, 36592, 264, 12056, 2541, 12970, 95512, 304, 220, 5926, 24, 15453, 13]	16	ok
411	Snowboarders now enjoy bindings with improved performance features daily.	[63385, 2541, 388, 1457, 4774, 36800, 449, 13241, 5178, 4519, 7446, 13]	12	ok
412	Randy Lee secured boots with bindings in 2014 innovation.	[49, 13634, 12336, 27528, 26302, 449, 36800, 304, 220, 679, 19, 19297, 13]	13	ok
413	Tom Sims invented snowboarding in 1963, pioneering the sport.	[25763, 52723, 36592, 12056, 38669, 304, 220, 5162, 18, 11, 71674, 279, 10775, 13]	14	ok
414	Tom Sims invented snowboarding in 1963, pioneering winter sports.	[25763, 52723, 36592, 12056, 38669, 304, 220, 5162, 18, 11, 71674, 12688, 10034, 13]	14	ok
415	Sims revolutionized snowboarding with metal-edged boards in 1982 advancements.	[50, 5861, 14110, 1534, 12056, 38669, 449, 9501, 35535, 3640, 21126, 304, 220, 3753, 17, 83787, 13]	17	ok
416	Burton and Winterstick pioneered snowboard technology in 1980 successfully.	[62339, 783, 323, 20704, 30133, 96734, 12056, 2541, 5557, 304, 220, 3753, 15, 7946, 13]	15	ok
417	Snowboarding gains popularity and commercialization in French ski resorts.	[63385, 38669, 20192, 23354, 323, 8518, 2065, 304, 8753, 29779, 61545, 13]	12	ok
418	Snowboards and monoskis have distinct user stances and designs.	[63385, 19826, 323, 1647, 437, 74, 285, 617, 12742, 1217, 357, 3095, 323, 14769, 13]	15	ok
419	Hedy Lamarr revolutionized wireless communication with her invention.	[39, 9497, 33794, 1138, 14110, 1534, 21401, 10758, 449, 1077, 28229, 13]	12	ok
420	Wi-Fi networks rely on Access Points and client devices.	[59128, 27395, 14488, 17631, 389, 9742, 21387, 323, 3016, 7766, 13]	11	ok
421	Wi-Fi technology enables wireless device connectivity via radio bands.	[59128, 27395, 5557, 20682, 21401, 3756, 31357, 4669, 9063, 21562, 13]	11	ok
422	Client Wi-Fi card firmware influences connection to nearby access points.	[3032, 17664, 27395, 3786, 30778, 34453, 3717, 311, 14373, 2680, 3585, 13]	12	ok
423	Wi-Fi originated from military technology in the 1980s.	[59128, 27395, 44853, 505, 6411, 5557, 304, 279, 220, 3753, 15, 82, 13]	13	ok
424	Legacy wireless protocol is woefully outdated and inefficient nowadays.	[78515, 21401, 11766, 374, 24670, 74092, 41626, 323, 64481, 46877, 13]	11	ok
425	The 802.11 technology was introduced in 1985 regulations.	[791, 220, 13135, 13, 806, 5557, 574, 11784, 304, 220, 3753, 20, 14640, 13]	14	ok
426	Wi-Fi was invented by NCR Corporation in 1991 Netherlands.	[59128, 27395, 574, 36592, 555, 452, 9150, 13332, 304, 220, 2550, 16, 26746, 13]	14	ok
427	Vic Hayes led IEEE's development of wireless protocols worldwide successfully.	[53, 292, 53522, 6197, 40135, 596, 4500, 315, 21401, 32885, 15603, 7946, 13]	13	ok
428	Early wireless technology paved the way for modern connectivity.	[42298, 21401, 5557, 63675, 279, 1648, 369, 6617, 31357, 13]	10	ok
429	German parliament abolishes longest word in language history suddenly yesterday.	[33179, 21814, 37276, 21168, 22807, 3492, 304, 4221, 3925, 15187, 13985, 13]	12	ok
430	Guinness World Record holder of the longest monosyllabic word.	[17198, 71773, 4435, 13896, 12102, 315, 279, 22807, 1647, 437, 25734, 69391, 3492, 13]	14	ok
431	The article discusses exceptionally long English words and their meanings.	[791, 4652, 35434, 48298, 1317, 6498, 4339, 323, 872, 50800, 13]	11	ok
432	The longest word in Spanish is superextraordinarísimo.	[791, 22807, 3492, 304, 15506, 374, 2307, 15824, 6114, 277, 24315, 11620, 13]	13	ok
433	Man spends three hours pronouncing record-breaking protein name slowly.	[1692, 38202, 2380, 4207, 19126, 37857, 3335, 55407, 13128, 836, 14297, 13]	12	ok
434	The longest words in English language are quite fascinating naturally.	[791, 22807, 4339, 304, 6498, 4221, 527, 5115, 27387, 18182, 13]	11	ok
435	Oxford English Dictionary holds longest word record title.	[46, 23382, 6498, 10685, 10187, 22807, 3492, 3335, 2316, 13]	10	ok
436	German language forms complex words through word combinations naturally.	[33179, 4221, 7739, 6485, 4339, 1555, 3492, 28559, 18182, 13]	10	ok
437	German law abolished longest word in language history recently.	[33179, 2383, 81081, 22807, 3492, 304, 4221, 3925, 6051, 13]	10	ok
438	German numbers are written as single words always.	[33179, 5219, 527, 5439, 439, 3254, 4339, 2744, 13]	9	ok
439	US Zip Code facilitates mail delivery nationwide efficiently and effectively.	[2078, 30332, 6247, 73633, 8232, 9889, 29054, 30820, 323, 13750, 13]	11	ok
440	Postal codes vary by country and region worldwide.	[44900, 14236, 13592, 555, 3224, 323, 5654, 15603, 13]	9	ok
441	Jonatan Heyman created a website for postal codes.	[38252, 16623, 28653, 1543, 3549, 264, 3997, 369, 40854, 14236, 13]	11	ok
442	Zip code is a numerical code for mail sorting purposes worldwide.	[32147, 2082, 374, 264, 35876, 2082, 369, 8232, 29373, 10096, 15603, 13]	12	ok
443	US uses ZIP Code system for mail delivery organization nationwide efficiently.	[2078, 5829, 57774, 6247, 1887, 369, 8232, 9889, 7471, 29054, 30820, 13]	12	ok
444	US ZIP Codes facilitate mail delivery and address lookup globally.	[2078, 57774, 41661, 28696, 8232, 9889, 323, 2686, 19128, 31550, 13]	11	ok
445	Find your exact zip code by sharing your location.	[10086, 701, 4839, 10521, 2082, 555, 11821, 701, 3813, 13]	10	ok
446	Most postal codes use numeric systems with limited encoding.	[13622, 40854, 14236, 1005, 25031, 6067, 449, 7347, 11418, 13]	10	ok
447	International mail requires country code for continental European countries.	[34746, 8232, 7612, 3224, 2082, 369, 58636, 7665, 5961, 13]	10	ok
448	Postal codes facilitate mail sorting and delivery worldwide efficiently always.	[44900, 14236, 28696, 8232, 29373, 323, 9889, 15603, 30820, 2744, 13]	11	ok
449	Notable Scottish figures shape the country's rich history and identity.	[2688, 481, 27188, 12678, 6211, 279, 3224, 596, 9257, 3925, 323, 9764, 13]	13	ok
450	Famous Scottish individuals excel in various fields worldwide significantly.	[37, 23333, 27188, 7931, 25555, 304, 5370, 5151, 15603, 12207, 13]	11	ok
451	Notable Scottish historical figures have shaped the nation's past significantly.	[2688, 481, 27188, 13970, 12678, 617, 27367, 279, 7140, 596, 3347, 12207, 13]	13	ok
452	Notable Scottish actors have made significant contributions to Hollywood.	[2688, 481, 27188, 20142, 617, 1903, 5199, 19564, 311, 17681, 13]	11	ok
453	Influential figures in Scottish history and modern times vary greatly.	[644, 27256, 2335, 12678, 304, 27188, 3925, 323, 6617, 3115, 13592, 19407, 13]	13	ok
454	The Baxter family's history dates back to ancient Scotland.	[791, 92847, 3070, 596, 3925, 13003, 1203, 311, 14154, 19627, 13]	11	ok
455	Scotland's famous inventions have non-Scottish origins and roots.	[96925, 596, 11495, 85149, 617, 2536, 12, 39320, 819, 33472, 323, 20282, 13]	13	ok
456	Popular name rankings vary across England, Wales, and the U.S.	[59552, 836, 33407, 13592, 4028, 9635, 11, 23782, 11, 323, 279, 549, 815, 13]	14	ok
457	Scotland has limited self-government and UK parliamentary representation.	[96925, 706, 7347, 659, 46704, 323, 6560, 44250, 13340, 13]	10	ok
458	Famous Scots have made significant contributions worldwide historically.	[37, 23333, 75367, 617, 1903, 5199, 19564, 15603, 35901, 13]	10	ok
459	Pathologist training requires four years of medical school and residency.	[1858, 16549, 4967, 7612, 3116, 1667, 315, 6593, 2978, 323, 53966, 13]	12	ok
460	Pathologists' median annual earnings vary significantly by specialty type.	[1858, 22012, 6, 23369, 9974, 24608, 13592, 12207, 555, 36974, 955, 13]	12	ok
461	Pathologist is a medical doctor studying disease mechanisms scientifically.	[1858, 16549, 374, 264, 6593, 10896, 21630, 8624, 24717, 74647, 13]	11	ok
462	Pathologists typically require medical school and an MD degree.	[1858, 22012, 11383, 1397, 6593, 2978, 323, 459, 14306, 8547, 13]	11	ok
463	Pathologist's assistant requires specialized training and scientific aptitude naturally.	[1858, 16549, 596, 18328, 7612, 28175, 4967, 323, 12624, 20697, 3993, 18182, 13]	13	ok
464	Pathologists' assistants' salaries vary widely based on experience and location.	[1858, 22012, 6, 57619, 6, 37532, 13592, 13882, 3196, 389, 3217, 323, 3813, 13]	14	ok
465	Certification requirements vary by state for pathologist assistants nationwide.	[38034, 2461, 8670, 13592, 555, 1614, 369, 1853, 16549, 57619, 29054, 13]	12	ok
466	Pathologists require medical degree and clinical pathology training typically.	[1858, 22012, 1397, 6593, 8547, 323, 14830, 77041, 4967, 11383, 13]	11	ok
467	Pathology assistants' median income is expected to rise significantly nationwide.	[1858, 2508, 57619, 6, 23369, 8070, 374, 3685, 311, 10205, 12207, 29054, 13]	13	ok
468	Pathology assistants gain hands-on experience in autopsy procedures daily.	[1858, 2508, 57619, 8895, 6206, 10539, 3217, 304, 76901, 16346, 7446, 13]	12	ok
469	Soil temperatures indicate incorrect timing for crabgrass control advice.	[4516, 321, 20472, 13519, 15465, 18912, 369, 60512, 54454, 2585, 9650, 13]	12	ok
470	Timing is crucial for effective crabgrass control in Atlanta.	[63905, 374, 16996, 369, 7524, 60512, 54454, 2585, 304, 20005, 13]	11	ok
471	Apply pre-emergent herbicide before crabgrass blooms in spring season.	[29597, 864, 37612, 2431, 306, 39999, 14842, 1603, 60512, 54454, 92889, 304, 10683, 3280, 13]	15	ok
472	Scotts Halts Crabgrass Preventer application guidelines vary by region.	[39320, 82, 20442, 2641, 75204, 54454, 39168, 261, 3851, 17959, 13592, 555, 5654, 13]	14	ok
473	Pre-emergent herbicides prevent weed seeds from germinating naturally always.	[4808, 37612, 2431, 306, 39999, 76195, 5471, 40475, 19595, 505, 17684, 65383, 18182, 2744, 13]	15	ok
474	Pre-emergent herbicides prevent crabgrass growth before germination.	[4808, 37612, 2431, 306, 39999, 76195, 5471, 60512, 54454, 6650, 1603, 17684, 33196, 13]	14	ok
475	Apply crabgrass preventer before germination in early spring season.	[29597, 60512, 54454, 5471, 261, 1603, 17684, 33196, 304, 4216, 10683, 3280, 13]	13	ok
476	Crabgrass seeds can easily spread to lawns through various means.	[16384, 370, 54454, 19595, 649, 6847, 9041, 311, 2383, 4511, 1555, 5370, 3445, 13]	14	ok
477	Crabgrass seeds germinate at 50 degrees for 3 consecutive nights.	[16384, 370, 54454, 19595, 17684, 35116, 520, 220, 1135, 12628, 369, 220, 18, 24871, 22178, 13]	16	ok
478	Apply Scotts Halts Crabgrass Preventer in early spring season.	[29597, 10016, 82, 20442, 2641, 75204, 54454, 39168, 261, 304, 4216, 10683, 3280, 13]	14	ok
479	DNA polymerases assemble nucleotides to create identical DNA strands.	[56420, 47393, 2315, 42840, 31484, 354, 3422, 311, 1893, 20086, 15922, 69864, 13]	13	ok
480	DNA polymerases synthesize new DNA strands and replace primers.	[56420, 47393, 2315, 6925, 27985, 502, 15922, 69864, 323, 8454, 9036, 388, 13]	13	ok
481	DNA polymerase assembles DNA strands through nucleotide bonding.	[56420, 47393, 521, 439, 41794, 15922, 69864, 1555, 31484, 69044, 64186, 13]	12	ok
482	DNA polymerase assembles DNA strands from nucleotides.	[56420, 47393, 521, 439, 41794, 15922, 69864, 505, 31484, 354, 3422, 13]	12	ok
483	"The double-helix structure allows for precise base pairing.

